{"backend":{"inference_settings":{"reasoning_effort":"high"},"kind":"codex_cli","model":"gpt-5.6-sol","protocol_version":"codex-exec@0.147.0","provider":"openai"},"exit_code":0,"input_files":{"agent_input/candidate-output.schema.json":"sha256:84756b26da6271c1e79ba68408b24869fc421ed80aaffff4f90160131fe635df","agent_input/contexts/095aca30e8a5fc8109f1a95547cea74e1789b11cc0cb49e5f374c6b7ac1d13af/envelope.json":"sha256:42b5b4f8d833a182436c756387c97c0578383954ca18bd2c9400735b0860f630","agent_input/contexts/095aca30e8a5fc8109f1a95547cea74e1789b11cc0cb49e5f374c6b7ac1d13af/source-index.json":"sha256:a969bfd8e6e52576c5d01e7b256bb51f9ad6f3ceec0ee68aca88389c013383b8","agent_input/contexts/095aca30e8a5fc8109f1a95547cea74e1789b11cc0cb49e5f374c6b7ac1d13af/sources/0000.txt":"sha256:62a8f0ec52962cff276b4c598b2c337634578578112ddeeb7858c5419d32a981","agent_input/contexts/8b776d266bd6c5166f40d39a662fb58b33fb6f70b60d02e0ca5bc7fbbeac867f/envelope.json":"sha256:1c7eece424f15f2378ee318130b4586796671037f08a07aaed91230831be8aa9","agent_input/contexts/8b776d266bd6c5166f40d39a662fb58b33fb6f70b60d02e0ca5bc7fbbeac867f/source-index.json":"sha256:dec540e355c3f02599e3b39b62f0e40da515bee24a760c8a9eef2baf5ada3ceb","agent_input/contexts/8b776d266bd6c5166f40d39a662fb58b33fb6f70b60d02e0ca5bc7fbbeac867f/sources/0000.txt":"sha256:62a8f0ec52962cff276b4c598b2c337634578578112ddeeb7858c5419d32a981","agent_input/contexts/9b7b34501ba1d58af75a11c792adf50a42292608a51d533e48321ed148df6cba/envelope.json":"sha256:60434d500439c569452a9b176ff42cea151a74f16545273736ad0164b05dc445","agent_input/contexts/9b7b34501ba1d58af75a11c792adf50a42292608a51d533e48321ed148df6cba/source-index.json":"sha256:e4f67e9c93dcb7fb05e2328003111773e7de014c940826b1261aafd80fb15900","agent_input/contexts/9b7b34501ba1d58af75a11c792adf50a42292608a51d533e48321ed148df6cba/sources/0000.txt":"sha256:62a8f0ec52962cff276b4c598b2c337634578578112ddeeb7858c5419d32a981","agent_input/contexts/ac359dcc1a2156056cd556cbe612af5bfc66cbc04cbfbb049d281bbf6853b78f/envelope.json":"sha256:e37cf935f9089aebd67c56356f0091ecc4aff388e07e1047c1d889d800d54a8d","agent_input/contexts/ac359dcc1a2156056cd556cbe612af5bfc66cbc04cbfbb049d281bbf6853b78f/source-index.json":"sha256:2bb791a2716ae036499ee46e70a7b501e569a62de2d05486f44fc1bccdad5cc5","agent_input/contexts/ac359dcc1a2156056cd556cbe612af5bfc66cbc04cbfbb049d281bbf6853b78f/sources/0000.txt":"sha256:62a8f0ec52962cff276b4c598b2c337634578578112ddeeb7858c5419d32a981","agent_input/contexts/b1db9c9a4046b2ba0e5db01d66a3206eeb989aec6c9eeb79ebafe13aa1fd2fb1/envelope.json":"sha256:8d1390d12c5209fbbbf535c07e27bd8043a1870010443ede0fd5ffe5dfb3c9ec","agent_input/contexts/b1db9c9a4046b2ba0e5db01d66a3206eeb989aec6c9eeb79ebafe13aa1fd2fb1/source-index.json":"sha256:4f53cda18c2baa0c0354bb5f9a3ecbe5ed12ab4d8e11ba873c2f11161202b945","agent_input/instruction.txt":"sha256:3df6b5270048166160b6f23fb148984350f2611cac211e3136ced2993e39267a","agent_input/mechanism-ontology.json":"sha256:7f79f39e74fc9e50151fb9a8c2895c6c19a0ebd5ac64295112e9e1a2073a820a","agent_input/obligations.json":"sha256:d51d893d6bfee13eb8cfaa59c5f81e927ac7eb3c2fd51af771ec1876b76bc8b1","agent_input/trial.json":"sha256:386aa1a473dab82f11f2a281026d3d618ef8dc326c9c8e823f4ae809c5366c96","manifest.json":"sha256:002ab079e47b80122c40390ee267d079141d4b1795a419307c7995cd452500cd"},"input_manifest_hash":"sha256:8c40dedd7c5f4c465c9f38868419d1e8fae1b0459448edf5f9ef1ae5e42b32b1","prompt_hash":"sha256:53814775a848af6b911a2b484e9b05fc7449e0a05c118cca42728f5c9d4ef370","prompt_version":"reviewgraphen.process_reviewer_prompt.v1","raw_response":"{\"schema\":\"reviewgraphen.benchmark.candidate_output.v1\",\"trial_id\":\"m7-real:snapshot-31:full_review_graphen:2\",\"outcome\":\"structured\",\"findings\":[],\"obligation_results\":[{\"packet_id\":\"context-envelope:sha256:3c2926c0c25569d034fc345ff14d3305fa1ab17fda8ff571780ea8906c07d478\",\"disposition\":\"inconclusive\",\"finding_local_ids\":[]},{\"packet_id\":\"context-envelope:sha256:6c3e9bc6e49b87318c337016ed3e1db6f626fb98aa5cee62a182e85f1520626c\",\"disposition\":\"inconclusive\",\"finding_local_ids\":[]},{\"packet_id\":\"context-envelope:sha256:7426d11f706af354ce1dbf010f9d3afc479e6b9f04735103a8b66bf9e2035d06\",\"disposition\":\"inconclusive\",\"finding_local_ids\":[]},{\"packet_id\":\"context-envelope:sha256:829e921493ecb50d0fa8cc827ef236a292da32cbc9a5b0ae3ba1e5ac72bac97f\",\"disposition\":\"inconclusive\",\"finding_local_ids\":[]},{\"packet_id\":\"context-envelope:sha256:af118ef93f09793be9f6f47c10b9c0f991cbdd0b85effa82fefd382a49eccd0b\",\"disposition\":\"inconclusive\",\"finding_local_ids\":[]}]}","raw_response_hash":"sha256:16612e56eec3c22d4d4399b035f53ba6e83030b3afccf80f4e8ae1c3d3a11ba5","schema":"reviewgraphen.process_reviewer_record.v1","stderr_hash":"sha256:3e75d28a6681c31400a3f0fcb564c7613fd42796fb83294e4d53fea86bcbd401","stdout_hash":"sha256:d312a0a6e7e0f6bff6e90f09b198bf7bca902d4160fa9174f1d3ab80ead75e29","tool_policy_version":"reviewgraphen.process_reviewer.bwrap-no-tools.v1"}