{"backend":{"inference_settings":{"reasoning_effort":"high"},"kind":"codex_cli","model":"gpt-5.6-sol","protocol_version":"codex-exec@0.147.0","provider":"openai"},"exit_code":0,"input_files":{"examples/fslc-01.rs":"sha256:d85cb9623078fdf12af775b9ddaafdb07bab3e6a4aab34f25dea4830659f9f32","examples/fslc-02.rs":"sha256:392e2da1d5b835b5150f1a0c42903ac87fa2d887f607c5adef8cc2d9593cf150","instruction.json":"sha256:98fcaa39310a880728619bb742552366514a9bb6f91efe52b86db17ab54be5df","manifests/rust/Cargo.toml":"sha256:c682af24383065f4e20ccf3d58d37ca133950742e272ac9cd6780b1eb6bb5282","manifests/rust/fslc/Cargo.toml":"sha256:038654fe8775a7fdfc36fb311db857f9ff0839f8a09ac328230173f5f3015b95","output.schema.json":"sha256:f5479bd5d76d237490e9d19b83df883220ecdad8e8d168bb572d3e7831a00dc0","sources/rust/fslc/src/lib.rs":"sha256:db37d7be8510ce882cb2ca119e3bde1b0a61a4d7bae9a4fd3bd8f47183e58d6f","sources/rust/fslc/src/main.rs":"sha256:977e712f248dc0ddd8f1a8ec6fa1727e2132abb3f50d36d5c3e5561f8dee48e1","sources/rust/fslc/src/verification.rs":"sha256:b5874bf828ee0b2cbb94b0d1adc79a2ae2f6ef9e4bab05bd84fbc0cc7bcc8ab0","target-hint.json":"sha256:00f5cabc9a0e839ce88a151a6534e4ebf0c8d7fc6887baddee8b13558e4b21b3"},"input_manifest_hash":"sha256:a6174bd7ff03bd266dd8f8f507972a59a188047806680926deb4d5967c6ac862","prompt_hash":"sha256:53814775a848af6b911a2b484e9b05fc7449e0a05c118cca42728f5c9d4ef370","prompt_version":"reviewgraphen.process_reviewer_prompt.v1","raw_response":"{\"expected_behavior\":\"`fslc db check` must propagate any non-verdict verification failure (including internal exit status 3) unchanged. Only verification statuses 0 and 1 may be merged into the database-check envelope.\",\"fix_patch\":\"diff --git a/rust/fslc/src/main.rs b/rust/fslc/src/main.rs\\n--- a/rust/fslc/src/main.rs\\n+++ b/rust/fslc/src/main.rs\\n@@ -5916,6 +5916,6 @@ fn run_db_check(path: &Path, depth: usize, deadlock: &str, engine: &str) -> (Value, i32) {\\n         let (kernel, kernel_status) =\\n             run_verify(path, depth, deadlock, engine, DEFAULT_EXPLICIT_BUDGET, 1);\\n-        if kernel_status == 2 {\\n+        if kernel_status >= 2 {\\n             return (kernel, kernel_status);\\n         }\\n         if let Value::Object(kernel) = kernel {\\n\",\"outcome\":\"proposal\",\"proposal_id\":\"proposal:calibration-09\",\"schema\":\"reviewgraphen.benchmark.test_fix_proposal.v1\",\"spec_queries\":[\"run_db_check kernel_status internal error propagation\",\"verification exit status 3 specialized command envelope\",\"database check run_verify non-verdict status contract\"],\"test_patch\":\"diff --git a/rust/fslc/tests/reviewgraphen_generated_calibration_09.rs b/rust/fslc/tests/reviewgraphen_generated_calibration_09.rs\\nnew file mode 100644\\n--- /dev/null\\n+++ b/rust/fslc/tests/reviewgraphen_generated_calibration_09.rs\\n@@ -0,0 +1,20 @@\\n+// SPDX-License-Identifier: Apache-2.0\\n+\\n+#[test]\\n+fn reviewgraphen_generated_regression() {\\n+    let source = include_str!(\\\"../src/main.rs\\\");\\n+    let start = source.find(\\\"fn run_db_check(\\\").expect(\\\"run_db_check\\\");\\n+    let function = source\\n+        .get(start..)\\n+        .and_then(|tail| tail.split_once(\\\"\\\\nfn run_db_observe(\\\").map(|(body, _)| body))\\n+        .expect(\\\"run_db_check body\\\");\\n+\\n+    assert!(\\n+        function.contains(\\\"if kernel_status >= 2 {\\\")\\n+            || function.contains(\\\"if kernel_status > 1 {\\\"),\\n+        \\\"db check must propagate internal verification failures\\\"\\n+    );\\n+    assert!(\\n+        !function.contains(\\\"if kernel_status == 2 {\\\"),\\n+        \\\"status 3 must not be wrapped as a database-check result\\\"\\n+    );\\n+}\\n\",\"test_target_id\":\"test-target-01\",\"unverifiable_reason\":\"\"}","raw_response_hash":"sha256:f0802e54578f7035c07a4f437e8489c32ca5103ddf9555f0d6e692d546ed04ed","schema":"reviewgraphen.process_reviewer_record.v1","stderr_hash":"sha256:3e75d28a6681c31400a3f0fcb564c7613fd42796fb83294e4d53fea86bcbd401","stdout_hash":"sha256:75956620f0795263783005491e75d213634dc228c16f1a8f5449dd3a66e33997","tool_policy_version":"reviewgraphen.process_reviewer.bwrap-no-tools.v1"}