{"backend":{"inference_settings":{"reasoning_effort":"high"},"kind":"codex_cli","model":"gpt-5.6-sol","protocol_version":"codex-exec@0.147.0","provider":"openai"},"exit_code":0,"input_files":{"agent_input/candidate-output.schema.json":"sha256:84756b26da6271c1e79ba68408b24869fc421ed80aaffff4f90160131fe635df","agent_input/contexts/40d2e5322a88008084ff8a373f6b2363c1347eeb596afe8bd8dee83d24219bb4/envelope.json":"sha256:9c2288832e49dcd0758dd92cb433344a4abd37a67586dfcccdb8f919fafa778c","agent_input/contexts/40d2e5322a88008084ff8a373f6b2363c1347eeb596afe8bd8dee83d24219bb4/source-index.json":"sha256:4f53cda18c2baa0c0354bb5f9a3ecbe5ed12ab4d8e11ba873c2f11161202b945","agent_input/contexts/5d5528ef443e56d1729799ee70de530222fab9264e4c4564dae160425ad061c2/envelope.json":"sha256:c099d96d0ccbcb5abb7de530d0e0e68d85ca2d4dcca9bc6235d3d672ebf945cf","agent_input/contexts/5d5528ef443e56d1729799ee70de530222fab9264e4c4564dae160425ad061c2/source-index.json":"sha256:fa1f6618da73f69ae94ef21d6777c60c6627ba876332b52986f8511b9e13ddac","agent_input/contexts/5d5528ef443e56d1729799ee70de530222fab9264e4c4564dae160425ad061c2/sources/0000.txt":"sha256:240635c35b84d1d94bfb09f34b6c4998dbf88eb7445907b7fc8a75bb8b55ec3f","agent_input/contexts/5d5528ef443e56d1729799ee70de530222fab9264e4c4564dae160425ad061c2/sources/0001.txt":"sha256:a8d88db091cf0a74e0fb4ecbef52ca1aaf2baa6e49fc6aeaba97ca12aa970a71","agent_input/contexts/5d5528ef443e56d1729799ee70de530222fab9264e4c4564dae160425ad061c2/sources/0002.txt":"sha256:c0c8f83752307e8232cd88e4159ace3cec58ef86b99a5f749f273d0797973b35","agent_input/contexts/74c28759688f8c3a543b08485b22a483895eccc57415aa73c629092c130206ed/envelope.json":"sha256:006c666196b72c7ad2eb2ec5dd284b50a398854ae92c308573211b7a46dc6ad8","agent_input/contexts/74c28759688f8c3a543b08485b22a483895eccc57415aa73c629092c130206ed/source-index.json":"sha256:a51e444bb515fba37d7653d187d020918717664d8d73756e128bffa80e3cfd39","agent_input/contexts/74c28759688f8c3a543b08485b22a483895eccc57415aa73c629092c130206ed/sources/0000.txt":"sha256:240635c35b84d1d94bfb09f34b6c4998dbf88eb7445907b7fc8a75bb8b55ec3f","agent_input/contexts/74c28759688f8c3a543b08485b22a483895eccc57415aa73c629092c130206ed/sources/0001.txt":"sha256:a8d88db091cf0a74e0fb4ecbef52ca1aaf2baa6e49fc6aeaba97ca12aa970a71","agent_input/contexts/74c28759688f8c3a543b08485b22a483895eccc57415aa73c629092c130206ed/sources/0002.txt":"sha256:c0c8f83752307e8232cd88e4159ace3cec58ef86b99a5f749f273d0797973b35","agent_input/contexts/8f975db8a51432eec6be3c6aab025720a836ce8b769c77fbb6945ec28d2c3350/envelope.json":"sha256:e345ed73345ee442fc74bdc4674213dfd11c272de5c9ba1ef1b09a8041450268","agent_input/contexts/8f975db8a51432eec6be3c6aab025720a836ce8b769c77fbb6945ec28d2c3350/source-index.json":"sha256:873e8abcca336b5b9245f94c5bc80a382d6467bcfad259b048263931c2c3eea3","agent_input/contexts/8f975db8a51432eec6be3c6aab025720a836ce8b769c77fbb6945ec28d2c3350/sources/0000.txt":"sha256:240635c35b84d1d94bfb09f34b6c4998dbf88eb7445907b7fc8a75bb8b55ec3f","agent_input/contexts/8f975db8a51432eec6be3c6aab025720a836ce8b769c77fbb6945ec28d2c3350/sources/0001.txt":"sha256:a8d88db091cf0a74e0fb4ecbef52ca1aaf2baa6e49fc6aeaba97ca12aa970a71","agent_input/contexts/8f975db8a51432eec6be3c6aab025720a836ce8b769c77fbb6945ec28d2c3350/sources/0002.txt":"sha256:c0c8f83752307e8232cd88e4159ace3cec58ef86b99a5f749f273d0797973b35","agent_input/contexts/a7abe19b4a3d747c00259b9093470c04b162acd7651868deff5b6eab6ac7fe85/envelope.json":"sha256:1701737fd17cb5829139ce7acdb0d9c5008f2d5c0b6ae5a8cd9dcaf82c67e235","agent_input/contexts/a7abe19b4a3d747c00259b9093470c04b162acd7651868deff5b6eab6ac7fe85/source-index.json":"sha256:dbfca68e41abdf0da5e9fcb25659ad393a7f01e9c9a3b83372066729f773b79a","agent_input/contexts/a7abe19b4a3d747c00259b9093470c04b162acd7651868deff5b6eab6ac7fe85/sources/0000.txt":"sha256:240635c35b84d1d94bfb09f34b6c4998dbf88eb7445907b7fc8a75bb8b55ec3f","agent_input/contexts/a7abe19b4a3d747c00259b9093470c04b162acd7651868deff5b6eab6ac7fe85/sources/0001.txt":"sha256:a8d88db091cf0a74e0fb4ecbef52ca1aaf2baa6e49fc6aeaba97ca12aa970a71","agent_input/contexts/a7abe19b4a3d747c00259b9093470c04b162acd7651868deff5b6eab6ac7fe85/sources/0002.txt":"sha256:c0c8f83752307e8232cd88e4159ace3cec58ef86b99a5f749f273d0797973b35","agent_input/instruction.txt":"sha256:3df6b5270048166160b6f23fb148984350f2611cac211e3136ced2993e39267a","agent_input/mechanism-ontology.json":"sha256:7f79f39e74fc9e50151fb9a8c2895c6c19a0ebd5ac64295112e9e1a2073a820a","agent_input/obligations.json":"sha256:7e3aa119dfd5a896845ec89e1a3944df82a8391060581caaa31ce93398d7d386","agent_input/trial.json":"sha256:22ecf3a5fa9c734ba54bd2763c322546c83eed1b05058d4047036130efc66618","manifest.json":"sha256:8a7b3f32a096a758e7015d0a3b48ddc3884fc77cac3459cb932c22b9ce69156d"},"input_manifest_hash":"sha256:88d57c0088488baf31750d9330ed44e199ae3fec518fe168f76203689b4a1981","prompt_hash":"sha256:53814775a848af6b911a2b484e9b05fc7449e0a05c118cca42728f5c9d4ef370","prompt_version":"reviewgraphen.process_reviewer_prompt.v1","raw_response":"{\"schema\":\"reviewgraphen.benchmark.candidate_output.v1\",\"trial_id\":\"m7-real:snapshot-25:full_review_graphen:2\",\"outcome\":\"structured\",\"findings\":[{\"local_id\":\"F1\",\"locations\":[{\"path\":\"rust/fslc/src/main.rs\",\"start_line\":41,\"end_line\":76}],\"mechanism_tags\":[\"unstable_token\",\"repeatable_entry\",\"repeated_effect\",\"cross_file_effect\",\"check_write_gap\"],\"rationale\":\"The materialized filename is derived only from the source stem and process ID, and std::fs::write does not create it exclusively. Concurrent or reentrant materializations of the same source within one process therefore share a path: one call can overwrite another's file and either guard can delete it while still in use. A pre-existing path is also overwritten and subsequently removed.\",\"severity\":\"medium\"},{\"local_id\":\"F2\",\"locations\":[{\"path\":\"rust/fsl-syntax/src/ai_project.rs\",\"start_line\":18,\"end_line\":55},{\"path\":\"rust/fsl-syntax/src/ai_project.rs\",\"start_line\":300,\"end_line\":340}],\"mechanism_tags\":[\"cross_file_contract\",\"state_transition_gap\"],\"rationale\":\"PROJECT_BLOCKS and the documented raw-block contract include evaluator and failure_mode, but RAW_BLOCKS omits both. parse_ai_project consequently recognizes their boundaries and then silently discards them through the default match arm instead of preserving the promised AiRawBlock entries.\",\"severity\":\"medium\"},{\"local_id\":\"F3\",\"locations\":[{\"path\":\"rust/fslc/src/frontend_output.rs\",\"start_line\":106,\"end_line\":132},{\"path\":\"rust/fsl-syntax/src/ai_project.rs\",\"start_line\":388,\"end_line\":400}],\"mechanism_tags\":[\"cross_file_contract\"],\"rationale\":\"The project parser accepts arbitrary whitespace between a declaration kind and name, while is_ai_project requires a literal space on one line. Parser-valid declarations using a tab or newline can therefore bypass the AI-project checking path and be routed to an incompatible frontend.\",\"severity\":\"medium\"}],\"obligation_results\":[{\"packet_id\":\"context-envelope:sha256:3786312e601b67321ac51c177b582e2fd46a0bcc9101d73d3ab18163c09a857f\",\"disposition\":\"issue_present\",\"finding_local_ids\":[\"F1\"]},{\"packet_id\":\"context-envelope:sha256:4057e91ea6ab5aa16f066b9213853d5744b1365d83f09506061d47cf2c8c35f6\",\"disposition\":\"issue_present\",\"finding_local_ids\":[\"F1\"]},{\"packet_id\":\"context-envelope:sha256:5a3b8f9cd11983a5a15f757459f4853ef0e44838dcbbaa1dcba81c29cc87951d\",\"disposition\":\"issue_present\",\"finding_local_ids\":[\"F2\",\"F3\"]},{\"packet_id\":\"context-envelope:sha256:6390da8f1a238878d48e878d654bc37d438173ad300d5c5eccf24d906c58590b\",\"disposition\":\"inconclusive\",\"finding_local_ids\":[]},{\"packet_id\":\"context-envelope:sha256:a4b74cc439f0f86a6250b2a3fa42564dc103c398790af078ea2fb9d2dbde5a6c\",\"disposition\":\"issue_present\",\"finding_local_ids\":[\"F1\"]}]}","raw_response_hash":"sha256:6be866496fe8f4b69e1499857107d0f0853e169c953555fa698138bc0ee7c130","schema":"reviewgraphen.process_reviewer_record.v1","stderr_hash":"sha256:3e75d28a6681c31400a3f0fcb564c7613fd42796fb83294e4d53fea86bcbd401","stdout_hash":"sha256:a5ed226552ae6e3de825543130a561b5ae06bf4299858f63974017834839bc49","tool_policy_version":"reviewgraphen.process_reviewer.bwrap-no-tools.v1"}