{"backend":{"inference_settings":{"reasoning_effort":"high"},"kind":"codex_cli","model":"gpt-5.6-sol","protocol_version":"codex-exec@0.147.0","provider":"openai"},"exit_code":0,"input_files":{"agent_input/candidate-output.schema.json":"sha256:84756b26da6271c1e79ba68408b24869fc421ed80aaffff4f90160131fe635df","agent_input/contexts/1bd519fd4070ef88b1ff418393c7cae3e25df9fd831beb60792193d0264936e3/envelope.json":"sha256:00a2fed907947df61460e718c3d9793842b37104667c736454bd467548e53b81","agent_input/contexts/1bd519fd4070ef88b1ff418393c7cae3e25df9fd831beb60792193d0264936e3/source-index.json":"sha256:fabc865b9fff13d6694a9a8ba0321d85921eb3dd8f01872e0f0f0530ae6a23cc","agent_input/contexts/1bd519fd4070ef88b1ff418393c7cae3e25df9fd831beb60792193d0264936e3/sources/0000.txt":"sha256:3c024367a96ac18abfa7e8cc7bae901b8eaf13d85df122caf7ffbb922e8fe631","agent_input/contexts/1bd519fd4070ef88b1ff418393c7cae3e25df9fd831beb60792193d0264936e3/sources/0001.txt":"sha256:c0c8f83752307e8232cd88e4159ace3cec58ef86b99a5f749f273d0797973b35","agent_input/contexts/1bd519fd4070ef88b1ff418393c7cae3e25df9fd831beb60792193d0264936e3/sources/0002.txt":"sha256:c38a44928b6c0809b86641f158da7b2f07c88a493661723eb5cde6fe441d7c86","agent_input/contexts/39f87c409b2bc07260a3baf214187475c8a817412fec76c7c2536152c2c558de/envelope.json":"sha256:61c5755a31d184e9a781fdfaf23aa89d7dd846431e0a292c0b56da9cdf4d599b","agent_input/contexts/39f87c409b2bc07260a3baf214187475c8a817412fec76c7c2536152c2c558de/source-index.json":"sha256:e4a8183bf9c913dfd6b08c617701db36b3fbf0ff756a7fc7724bac585856f28f","agent_input/contexts/39f87c409b2bc07260a3baf214187475c8a817412fec76c7c2536152c2c558de/sources/0000.txt":"sha256:3c024367a96ac18abfa7e8cc7bae901b8eaf13d85df122caf7ffbb922e8fe631","agent_input/contexts/39f87c409b2bc07260a3baf214187475c8a817412fec76c7c2536152c2c558de/sources/0001.txt":"sha256:c0c8f83752307e8232cd88e4159ace3cec58ef86b99a5f749f273d0797973b35","agent_input/contexts/39f87c409b2bc07260a3baf214187475c8a817412fec76c7c2536152c2c558de/sources/0002.txt":"sha256:c38a44928b6c0809b86641f158da7b2f07c88a493661723eb5cde6fe441d7c86","agent_input/contexts/ded975e91bedfe534be89adbab3f3e191cde10dd9a9a46cb4f3e26d2acf523d8/envelope.json":"sha256:6793998ddc8843a0ba2272ba19d36ff0ccc6173625b7a1431d03ae119d0e4115","agent_input/contexts/ded975e91bedfe534be89adbab3f3e191cde10dd9a9a46cb4f3e26d2acf523d8/source-index.json":"sha256:93ada732112d10b9034b4aa93ef42cbe25d030b3240badcb32df73f3f09e4904","agent_input/contexts/ded975e91bedfe534be89adbab3f3e191cde10dd9a9a46cb4f3e26d2acf523d8/sources/0000.txt":"sha256:3c024367a96ac18abfa7e8cc7bae901b8eaf13d85df122caf7ffbb922e8fe631","agent_input/contexts/ded975e91bedfe534be89adbab3f3e191cde10dd9a9a46cb4f3e26d2acf523d8/sources/0001.txt":"sha256:c0c8f83752307e8232cd88e4159ace3cec58ef86b99a5f749f273d0797973b35","agent_input/contexts/ded975e91bedfe534be89adbab3f3e191cde10dd9a9a46cb4f3e26d2acf523d8/sources/0002.txt":"sha256:c38a44928b6c0809b86641f158da7b2f07c88a493661723eb5cde6fe441d7c86","agent_input/contexts/eb42c3cad49db47406d24df90966612aebd3de4b09502ff9e1db4ac39927ed3d/envelope.json":"sha256:bb2d49bac9219b8cbbb6092d6fcd68af3011669e0d60cf02485eaad2af974bf0","agent_input/contexts/eb42c3cad49db47406d24df90966612aebd3de4b09502ff9e1db4ac39927ed3d/source-index.json":"sha256:4f53cda18c2baa0c0354bb5f9a3ecbe5ed12ab4d8e11ba873c2f11161202b945","agent_input/contexts/f830dc8f493cad94b0b6989b4c2bcb1e3f6dbfcfcf1bb992e9a9fc92e5fd8bd7/envelope.json":"sha256:08a3c59e036cc29ae3dc42854e50a4624938ddd667ce5c3077887a33bc7ab450","agent_input/contexts/f830dc8f493cad94b0b6989b4c2bcb1e3f6dbfcfcf1bb992e9a9fc92e5fd8bd7/source-index.json":"sha256:b3faa19cb3c39055d9545b2b2c1f03841616a1f65ef9f43e91ba5da4e46e60f3","agent_input/contexts/f830dc8f493cad94b0b6989b4c2bcb1e3f6dbfcfcf1bb992e9a9fc92e5fd8bd7/sources/0000.txt":"sha256:3c024367a96ac18abfa7e8cc7bae901b8eaf13d85df122caf7ffbb922e8fe631","agent_input/contexts/f830dc8f493cad94b0b6989b4c2bcb1e3f6dbfcfcf1bb992e9a9fc92e5fd8bd7/sources/0001.txt":"sha256:c0c8f83752307e8232cd88e4159ace3cec58ef86b99a5f749f273d0797973b35","agent_input/contexts/f830dc8f493cad94b0b6989b4c2bcb1e3f6dbfcfcf1bb992e9a9fc92e5fd8bd7/sources/0002.txt":"sha256:c38a44928b6c0809b86641f158da7b2f07c88a493661723eb5cde6fe441d7c86","agent_input/instruction.txt":"sha256:3df6b5270048166160b6f23fb148984350f2611cac211e3136ced2993e39267a","agent_input/mechanism-ontology.json":"sha256:7f79f39e74fc9e50151fb9a8c2895c6c19a0ebd5ac64295112e9e1a2073a820a","agent_input/obligations.json":"sha256:bbea8a8601fdf10e85aadb3af5c02e25453c730c0d70a2abe6fc2f1b0c3511ad","agent_input/trial.json":"sha256:52c8178c9c08c13708cc236a2e0639ce84d91bd605572b5ee67563f3d8d5cad3","manifest.json":"sha256:53a414180a3040876d1f421c12e1dbd5959be64e76611218b646531587ceaee5"},"input_manifest_hash":"sha256:036b0c862a8280c9ae2c20eb5ebd7f0a33724caa7ef90eb53d5ebebaa4bdeb7f","prompt_hash":"sha256:53814775a848af6b911a2b484e9b05fc7449e0a05c118cca42728f5c9d4ef370","prompt_version":"reviewgraphen.process_reviewer_prompt.v1","raw_response":"{\"schema\":\"reviewgraphen.benchmark.candidate_output.v1\",\"trial_id\":\"m7-real:snapshot-26:full_review_graphen:1\",\"outcome\":\"structured\",\"findings\":[{\"local_id\":\"literate-materialization-collision\",\"locations\":[{\"path\":\"rust/fslc/src/main.rs\",\"start_line\":45,\"end_line\":72}],\"mechanism_tags\":[\"unstable_scope_key\",\"repeatable_entry\",\"repeated_effect\",\"check_write_gap\"],\"rationale\":\"The materialized filename is keyed only by source stem and process ID. Reentrant or concurrent materializations of the same Markdown source within one process therefore write the same file, and dropping either LiterateState removes the file still referenced by the other. std::fs::write also replaces or follows any pre-existing predictable path instead of atomically claiming a unique file.\",\"severity\":\"medium\"},{\"local_id\":\"unparsed-clause-order-loss\",\"locations\":[{\"path\":\"rust/fsl-syntax/src/ai_project.rs\",\"start_line\":164,\"end_line\":201},{\"path\":\"rust/fslc/src/frontend_output.rs\",\"start_line\":55,\"end_line\":83}],\"mechanism_tags\":[\"cross_file_contract\"],\"rationale\":\"unparsed_clauses emits every statistical-property failure before every observed-property failure because it chains two type-grouped collections. It does not preserve declaration source order as the caller assumes, so parse_checked_ai_project can report the location of a later statistical clause instead of the first offending clause in the file.\",\"severity\":\"low\"}],\"obligation_results\":[{\"packet_id\":\"context-envelope:sha256:0e5405b696ad9f0e2d4f6a84ff9754cbe3039e5c40a1bff80be1db455b0d4475\",\"disposition\":\"inconclusive\",\"finding_local_ids\":[]},{\"packet_id\":\"context-envelope:sha256:7cc2fbe5c3b20eecbaa22efd7e0135a834ce7bfeb5ccada51382ec50f6971d75\",\"disposition\":\"issue_present\",\"finding_local_ids\":[\"literate-materialization-collision\"]},{\"packet_id\":\"context-envelope:sha256:955a5c33a9ddb1e29039bdedceaf046cd096597db0c0350fc971a3a1bccb212a\",\"disposition\":\"issue_present\",\"finding_local_ids\":[\"unparsed-clause-order-loss\"]},{\"packet_id\":\"context-envelope:sha256:ad322f1ee3d8c944662656a35e7869fed84ecb51706da03c2d5c81193f904644\",\"disposition\":\"issue_present\",\"finding_local_ids\":[\"literate-materialization-collision\"]},{\"packet_id\":\"context-envelope:sha256:baa58055076b3c8ec120558f4f1d459ea8242f0b2cb05fbb0b0a96b107374192\",\"disposition\":\"inconclusive\",\"finding_local_ids\":[]}]}","raw_response_hash":"sha256:317bec20c576cf8b868b41d119b3d4bf70db258e8ff18d4df041b786828e97dd","schema":"reviewgraphen.process_reviewer_record.v1","stderr_hash":"sha256:3e75d28a6681c31400a3f0fcb564c7613fd42796fb83294e4d53fea86bcbd401","stdout_hash":"sha256:441d651b89b16a4292cbe58a5ace862d77fc0f670a692209b3e57a5aa194f7c1","tool_policy_version":"reviewgraphen.process_reviewer.bwrap-no-tools.v1"}