{"backend":{"inference_settings":{"reasoning_effort":"high"},"kind":"codex_cli","model":"gpt-5.6-sol","protocol_version":"codex-exec@0.147.0","provider":"openai"},"exit_code":0,"input_files":{"agent_input/candidate-output.schema.json":"sha256:84756b26da6271c1e79ba68408b24869fc421ed80aaffff4f90160131fe635df","agent_input/contexts/0ec31e80d81b992642c834be87bf7508c233710069642f1b810826a6ca302159/envelope.json":"sha256:c6f5207f777f561e85f9c27a6a1c0d44c5ade75bf47f17cbdadad93f0a87547b","agent_input/contexts/0ec31e80d81b992642c834be87bf7508c233710069642f1b810826a6ca302159/source-index.json":"sha256:4f53cda18c2baa0c0354bb5f9a3ecbe5ed12ab4d8e11ba873c2f11161202b945","agent_input/contexts/4554c3cb57982b380c623aa4ff11c840ed1e8b9059c02fb850b3bf5452e84f1b/envelope.json":"sha256:dc3bd9abc95222c4da745d984d2f0bcfdf16a8d729ef0c3ce645b42e805fb45d","agent_input/contexts/4554c3cb57982b380c623aa4ff11c840ed1e8b9059c02fb850b3bf5452e84f1b/source-index.json":"sha256:786154a6c028a4deb87a4d6a2cea2d699bb68f52be16fbcee0a229c87df9da8d","agent_input/contexts/4554c3cb57982b380c623aa4ff11c840ed1e8b9059c02fb850b3bf5452e84f1b/sources/0000.txt":"sha256:86d3e05d6010a4ada652238c45391daf90dac020c36481560ef6e8dd206270b4","agent_input/contexts/4554c3cb57982b380c623aa4ff11c840ed1e8b9059c02fb850b3bf5452e84f1b/sources/0001.txt":"sha256:eb47eddf79e54bb9277516b68fae46a9f1403b528a7a2dcbc356298ab9caea15","agent_input/contexts/4554c3cb57982b380c623aa4ff11c840ed1e8b9059c02fb850b3bf5452e84f1b/sources/0002.txt":"sha256:e1319a41118b8ac4c3b9b79ea162b77bea267ad5a5577c52b770f2c62cd99a6a","agent_input/contexts/4554c3cb57982b380c623aa4ff11c840ed1e8b9059c02fb850b3bf5452e84f1b/sources/0003.txt":"sha256:99adca3f630a91eb66d50b583e8c58cc6cc57be5a1427fbb74c8a72aefd52ccf","agent_input/contexts/4554c3cb57982b380c623aa4ff11c840ed1e8b9059c02fb850b3bf5452e84f1b/sources/0004.txt":"sha256:50c36fb6d80335f14cb98489bac952ba0920cd57a89f772bc1d3fdabdd4ad26c","agent_input/contexts/7d55c6822ec7fa6f30296c6f649304a742962a5237ffc7214a0ef269d55a1741/envelope.json":"sha256:18f5ba23193d318d500a2f1ab65350d2681c8c587147a6b9e39b72873b4e8177","agent_input/contexts/7d55c6822ec7fa6f30296c6f649304a742962a5237ffc7214a0ef269d55a1741/source-index.json":"sha256:94b26282a55dc6368991f35396de06197e44ab4ec08f681dfbf21dc57b8645e7","agent_input/contexts/7d55c6822ec7fa6f30296c6f649304a742962a5237ffc7214a0ef269d55a1741/sources/0000.txt":"sha256:86d3e05d6010a4ada652238c45391daf90dac020c36481560ef6e8dd206270b4","agent_input/contexts/7d55c6822ec7fa6f30296c6f649304a742962a5237ffc7214a0ef269d55a1741/sources/0001.txt":"sha256:eb47eddf79e54bb9277516b68fae46a9f1403b528a7a2dcbc356298ab9caea15","agent_input/contexts/7d55c6822ec7fa6f30296c6f649304a742962a5237ffc7214a0ef269d55a1741/sources/0002.txt":"sha256:e1319a41118b8ac4c3b9b79ea162b77bea267ad5a5577c52b770f2c62cd99a6a","agent_input/contexts/7d55c6822ec7fa6f30296c6f649304a742962a5237ffc7214a0ef269d55a1741/sources/0003.txt":"sha256:99adca3f630a91eb66d50b583e8c58cc6cc57be5a1427fbb74c8a72aefd52ccf","agent_input/contexts/7d55c6822ec7fa6f30296c6f649304a742962a5237ffc7214a0ef269d55a1741/sources/0004.txt":"sha256:50c36fb6d80335f14cb98489bac952ba0920cd57a89f772bc1d3fdabdd4ad26c","agent_input/contexts/e27af9fa09b5b3c3cc96ed2a1be11918014d85f89d0feba5841b78147519f6b1/envelope.json":"sha256:de424dba76f5cd2ad85ed9a1d6156ad93b2d4facbbe73b8ff85d31d0adeedd73","agent_input/contexts/e27af9fa09b5b3c3cc96ed2a1be11918014d85f89d0feba5841b78147519f6b1/source-index.json":"sha256:7a189b600569a9cba81aff71ee111a5ded175c90087710989c6b8481d01d44ad","agent_input/contexts/e27af9fa09b5b3c3cc96ed2a1be11918014d85f89d0feba5841b78147519f6b1/sources/0000.txt":"sha256:86d3e05d6010a4ada652238c45391daf90dac020c36481560ef6e8dd206270b4","agent_input/contexts/e27af9fa09b5b3c3cc96ed2a1be11918014d85f89d0feba5841b78147519f6b1/sources/0001.txt":"sha256:eb47eddf79e54bb9277516b68fae46a9f1403b528a7a2dcbc356298ab9caea15","agent_input/contexts/e27af9fa09b5b3c3cc96ed2a1be11918014d85f89d0feba5841b78147519f6b1/sources/0002.txt":"sha256:e1319a41118b8ac4c3b9b79ea162b77bea267ad5a5577c52b770f2c62cd99a6a","agent_input/contexts/e27af9fa09b5b3c3cc96ed2a1be11918014d85f89d0feba5841b78147519f6b1/sources/0003.txt":"sha256:99adca3f630a91eb66d50b583e8c58cc6cc57be5a1427fbb74c8a72aefd52ccf","agent_input/contexts/e27af9fa09b5b3c3cc96ed2a1be11918014d85f89d0feba5841b78147519f6b1/sources/0004.txt":"sha256:50c36fb6d80335f14cb98489bac952ba0920cd57a89f772bc1d3fdabdd4ad26c","agent_input/contexts/eeac1e4b772aa9064a55ea73bc10056f989d90da5ea9ce1d415958beabb16a0a/envelope.json":"sha256:95279171a8133d3e7fc0545258a59278c7fc7cc8903b7f50d5552f463cc13c14","agent_input/contexts/eeac1e4b772aa9064a55ea73bc10056f989d90da5ea9ce1d415958beabb16a0a/source-index.json":"sha256:a65673727337413f09ba2da4a9420bc4714c34ebd231028c402a43ab913450d0","agent_input/contexts/eeac1e4b772aa9064a55ea73bc10056f989d90da5ea9ce1d415958beabb16a0a/sources/0000.txt":"sha256:86d3e05d6010a4ada652238c45391daf90dac020c36481560ef6e8dd206270b4","agent_input/contexts/eeac1e4b772aa9064a55ea73bc10056f989d90da5ea9ce1d415958beabb16a0a/sources/0001.txt":"sha256:eb47eddf79e54bb9277516b68fae46a9f1403b528a7a2dcbc356298ab9caea15","agent_input/contexts/eeac1e4b772aa9064a55ea73bc10056f989d90da5ea9ce1d415958beabb16a0a/sources/0002.txt":"sha256:e1319a41118b8ac4c3b9b79ea162b77bea267ad5a5577c52b770f2c62cd99a6a","agent_input/contexts/eeac1e4b772aa9064a55ea73bc10056f989d90da5ea9ce1d415958beabb16a0a/sources/0003.txt":"sha256:99adca3f630a91eb66d50b583e8c58cc6cc57be5a1427fbb74c8a72aefd52ccf","agent_input/contexts/eeac1e4b772aa9064a55ea73bc10056f989d90da5ea9ce1d415958beabb16a0a/sources/0004.txt":"sha256:50c36fb6d80335f14cb98489bac952ba0920cd57a89f772bc1d3fdabdd4ad26c","agent_input/instruction.txt":"sha256:3df6b5270048166160b6f23fb148984350f2611cac211e3136ced2993e39267a","agent_input/mechanism-ontology.json":"sha256:7f79f39e74fc9e50151fb9a8c2895c6c19a0ebd5ac64295112e9e1a2073a820a","agent_input/obligations.json":"sha256:abf6f4640e6bd015ac5ded29ff92557237356703ccc7c58d50287dcbe8f43280","agent_input/trial.json":"sha256:c4895c9e6438edd1549ee9d09b2103332a21af6bfb5762526e5a568f2c137986","manifest.json":"sha256:3f2a45a5d403ba533b5e2b5cb531124e150581c88a434a76e95508e0093a8207"},"input_manifest_hash":"sha256:b92fde9ee765fdd12026dd6a098810865f801801a77b2f063a862155ce8fdc2f","prompt_hash":"sha256:53814775a848af6b911a2b484e9b05fc7449e0a05c118cca42728f5c9d4ef370","prompt_version":"reviewgraphen.process_reviewer_prompt.v1","raw_response":"{\"schema\":\"reviewgraphen.benchmark.candidate_output.v1\",\"trial_id\":\"m7-real:snapshot-29:full_review_graphen:2\",\"outcome\":\"structured\",\"findings\":[{\"local_id\":\"F1\",\"locations\":[{\"path\":\"rust/fslc/src/frontend_output.rs\",\"start_line\":29,\"end_line\":78},{\"path\":\"rust/fsl-wasm/src/lib.rs\",\"start_line\":117,\"end_line\":127},{\"path\":\"rust/fsl-syntax/src/ai_project.rs\",\"start_line\":229,\"end_line\":278}],\"mechanism_tags\":[\"check_write_gap\",\"cross_file_contract\"],\"severity\":\"high\",\"rationale\":\"The WASM check path returns an ok result for any source that passes the shallow is_ai_project heuristic, without invoking parse_ai_project. A source with a recognized first declaration and a malformed, unterminated, or duplicate project declaration can therefore be reported as successfully analyzed even though the actual project parser rejects it.\"},{\"local_id\":\"F2\",\"locations\":[{\"path\":\"rust/fslc/src/main.rs\",\"start_line\":33,\"end_line\":65}],\"mechanism_tags\":[\"repeatable_entry\",\"repeated_effect\",\"unstable_scope_key\",\"unstable_token\"],\"severity\":\"medium\",\"rationale\":\"Literate materialization is keyed only by directory, stem, and process ID, then written with truncation and unconditionally removed on Drop. Reentrant or concurrent materializations of the same path within one process share a file, so one invocation can overwrite or delete the other's input; PID reuse can also overwrite and remove a stale or user-owned file at that predictable path.\"}],\"obligation_results\":[{\"packet_id\":\"context-envelope:sha256:1e8a7e051388548bf2c8f5d4515e7f698c749c6eca77007fdcb14d61e79eaed6\",\"disposition\":\"inconclusive\",\"finding_local_ids\":[]},{\"packet_id\":\"context-envelope:sha256:78a9784527db3f4a6f7ff2c10176b5628a2b75b5b0786fb2b6482613fa9b785b\",\"disposition\":\"issue_present\",\"finding_local_ids\":[\"F2\"]},{\"packet_id\":\"context-envelope:sha256:a0e23812def53f94be260d289ca5e25270a768d81486f9352dd244effbdc61f7\",\"disposition\":\"issue_present\",\"finding_local_ids\":[\"F1\"]},{\"packet_id\":\"context-envelope:sha256:b011a1c5ddbfc899d3dec2a47073ae08f2f09ed3105dffb7ca58a0c529dbebd9\",\"disposition\":\"inconclusive\",\"finding_local_ids\":[]},{\"packet_id\":\"context-envelope:sha256:d58badbb0873a5f457914c718ec88aa3ed694a46bb0faf09fd2eb240ca9afec7\",\"disposition\":\"issue_present\",\"finding_local_ids\":[\"F2\"]}]}","raw_response_hash":"sha256:6a031bdd5b500820d922cdc688210b77792e622d681c9cd2ff124cffdc6e144f","schema":"reviewgraphen.process_reviewer_record.v1","stderr_hash":"sha256:3e75d28a6681c31400a3f0fcb564c7613fd42796fb83294e4d53fea86bcbd401","stdout_hash":"sha256:a610a28bb7513025dd6cd8980c2fbab9622113d5ae1b0ce18e2e2f6dddf7ebcf","tool_policy_version":"reviewgraphen.process_reviewer.bwrap-no-tools.v1"}