{"backend":{"inference_settings":{"reasoning_effort":"high"},"kind":"codex_cli","model":"gpt-5.6-sol","protocol_version":"codex-exec@0.147.0","provider":"openai"},"exit_code":0,"input_files":{"agent_input/candidate-output.schema.json":"sha256:84756b26da6271c1e79ba68408b24869fc421ed80aaffff4f90160131fe635df","agent_input/contexts/2fcbaa0abe6a5a8b986145a5732afe14980f560a017aa08da5b72c0b5013a459/envelope.json":"sha256:57f4123871c8334e6a25afb244ec82b9dbc598eeaa877d11a6210cac749d2c5c","agent_input/contexts/2fcbaa0abe6a5a8b986145a5732afe14980f560a017aa08da5b72c0b5013a459/source-index.json":"sha256:60a7d556567c6d481f2c2952e6679ea9dd793756262daad875837b39f2d19dc0","agent_input/contexts/2fcbaa0abe6a5a8b986145a5732afe14980f560a017aa08da5b72c0b5013a459/sources/0000.txt":"sha256:e1319a41118b8ac4c3b9b79ea162b77bea267ad5a5577c52b770f2c62cd99a6a","agent_input/contexts/579a467a6b925230c1d4f6e923b1586a3f3d1a40631486d4e9226708ba9cfc95/envelope.json":"sha256:1b557a8a8184a2435b32f31455a72f99d6939f7c0907c4499de12832cf6f5f51","agent_input/contexts/579a467a6b925230c1d4f6e923b1586a3f3d1a40631486d4e9226708ba9cfc95/source-index.json":"sha256:5e961288a2ee47112d1f64dcc63fa5ae515c6993dd931d88f36c411e3a9a9c54","agent_input/contexts/579a467a6b925230c1d4f6e923b1586a3f3d1a40631486d4e9226708ba9cfc95/sources/0000.txt":"sha256:e1319a41118b8ac4c3b9b79ea162b77bea267ad5a5577c52b770f2c62cd99a6a","agent_input/contexts/58da4cd9dbbb3f704a439e8eab919ee36a61ab5883eedd85bbd95acf3ec10a17/envelope.json":"sha256:cf9b50c4699fd52284cf980fd6f8ed755dc72e327a41801dfcefdb0e5db9b701","agent_input/contexts/58da4cd9dbbb3f704a439e8eab919ee36a61ab5883eedd85bbd95acf3ec10a17/source-index.json":"sha256:39ce1d9e02b4cc7772abfda7374c5e8f7cbbf56c55e3b07cfc248ba93bd20b8e","agent_input/contexts/58da4cd9dbbb3f704a439e8eab919ee36a61ab5883eedd85bbd95acf3ec10a17/sources/0000.txt":"sha256:e1319a41118b8ac4c3b9b79ea162b77bea267ad5a5577c52b770f2c62cd99a6a","agent_input/contexts/99f7859530cac19b5de9c2d605795afd25d1f87f8d632e6f285b34a156fb40a8/envelope.json":"sha256:4e3eb3a35bf17e461d519ed6f2f38e4935781652e3655e27599496aaf5e3bc37","agent_input/contexts/99f7859530cac19b5de9c2d605795afd25d1f87f8d632e6f285b34a156fb40a8/source-index.json":"sha256:4f53cda18c2baa0c0354bb5f9a3ecbe5ed12ab4d8e11ba873c2f11161202b945","agent_input/contexts/da67423097d08fac1b0246706fc4e81d41e3c88033028c6cbbd4d5bc815a01df/envelope.json":"sha256:8bde5819ef4e26cc2b60fa4e363bf4f448efdd1b1601de4844f406e69eae6192","agent_input/contexts/da67423097d08fac1b0246706fc4e81d41e3c88033028c6cbbd4d5bc815a01df/source-index.json":"sha256:067d5956e7d3f23cf7af0518a3b59fa2809b89b078d7d1c69926eede80dd1283","agent_input/contexts/da67423097d08fac1b0246706fc4e81d41e3c88033028c6cbbd4d5bc815a01df/sources/0000.txt":"sha256:e1319a41118b8ac4c3b9b79ea162b77bea267ad5a5577c52b770f2c62cd99a6a","agent_input/instruction.txt":"sha256:3df6b5270048166160b6f23fb148984350f2611cac211e3136ced2993e39267a","agent_input/mechanism-ontology.json":"sha256:7f79f39e74fc9e50151fb9a8c2895c6c19a0ebd5ac64295112e9e1a2073a820a","agent_input/obligations.json":"sha256:a08e4493d5f0dc9afaf9d4bb3fa1f86504220f3c008091c59f0865340e5d4cbe","agent_input/trial.json":"sha256:9bf06795391fea6e0ed37010fff04101d37d1e793693bfd96695a4d211c39841","manifest.json":"sha256:4a2c472f6d467a74e4c4fdf7e20f173d2c51fb1857fdb8826df7d4f5b6217021"},"input_manifest_hash":"sha256:4d507dbc6dcdb365bcb4e461090965a5f920c76c1e1791907c3d430922cdc47b","prompt_hash":"sha256:53814775a848af6b911a2b484e9b05fc7449e0a05c118cca42728f5c9d4ef370","prompt_version":"reviewgraphen.process_reviewer_prompt.v1","raw_response":"{\"schema\":\"reviewgraphen.benchmark.candidate_output.v1\",\"trial_id\":\"m7-real:snapshot-35:full_review_graphen:1\",\"outcome\":\"structured\",\"findings\":[{\"local_id\":\"literate-materialization-key-collision\",\"locations\":[{\"path\":\"rust/fslc/src/main.rs\",\"start_line\":37,\"end_line\":40},{\"path\":\"rust/fslc/src/main.rs\",\"start_line\":60,\"end_line\":70}],\"mechanism_tags\":[\"repeatable_entry\",\"state_transition_gap\",\"unstable_scope_key\"],\"rationale\":\"The materialization path is keyed only by the source stem and process ID. Concurrent or overlapping materializations of the same Markdown path within one process therefore share a file: one call can overwrite the other's contents, and either guard's Drop can remove the file while the other operation still needs it. The path needs a per-materialization unique component and cleanup tied to exclusive ownership.\",\"severity\":\"medium\"}],\"obligation_results\":[{\"packet_id\":\"context-envelope:sha256:28228cbfda0d64cddc5d14e9a9effae987ed42fbc898f5666597c2b67e5bf387\",\"disposition\":\"issue_present\",\"finding_local_ids\":[\"literate-materialization-key-collision\"]},{\"packet_id\":\"context-envelope:sha256:6a50789d42dbf929509fac42193a824bfd0b7dee614611ab2464d4963668fb2d\",\"disposition\":\"inconclusive\",\"finding_local_ids\":[]},{\"packet_id\":\"context-envelope:sha256:bf33d9b4a3c4f0370f32f3db176b30ac7cf3b977d26d331109ae8bec8c89659d\",\"disposition\":\"inconclusive\",\"finding_local_ids\":[]},{\"packet_id\":\"context-envelope:sha256:bfad9849755bcc5f8dce06f9d5f8a4eb5e5bf6ecbcaeb627772c62d7ebb89576\",\"disposition\":\"inconclusive\",\"finding_local_ids\":[]},{\"packet_id\":\"context-envelope:sha256:de2ae28c193ec7bd8921fb573040122a2cdae59d1f36b456bb0b927cce70267d\",\"disposition\":\"issue_present\",\"finding_local_ids\":[\"literate-materialization-key-collision\"]}]}","raw_response_hash":"sha256:6086c958b84acb121a90b0c7f6157807e71e08faf3f164fa996b02faedf89500","schema":"reviewgraphen.process_reviewer_record.v1","stderr_hash":"sha256:905ffacdb9784e81dadee43ce67591b8bf09eca815a04a510b208e5c513f0b3d","stdout_hash":"sha256:0345e01012f87ebaba8d3bfb064afca9e7b2a28b132c4c5c3bb528863f9e7a99","tool_policy_version":"reviewgraphen.process_reviewer.bwrap-no-tools.v1"}