{"backend":{"inference_settings":{"reasoning_effort":"high"},"kind":"codex_cli","model":"gpt-5.6-sol","protocol_version":"codex-exec@0.147.0","provider":"openai"},"exit_code":0,"input_files":{"agent_input/candidate-output.schema.json":"sha256:84756b26da6271c1e79ba68408b24869fc421ed80aaffff4f90160131fe635df","agent_input/contexts/1e8a8a58f75e6d1da5ce21b8b1aab54da6bed4dc66d1d2adb571a48eef663a5c/envelope.json":"sha256:cb9a368112bccfa17511fd15519da52882792a7edd2fc4ac30f5bb6cd331b1a1","agent_input/contexts/1e8a8a58f75e6d1da5ce21b8b1aab54da6bed4dc66d1d2adb571a48eef663a5c/source-index.json":"sha256:f4dd83cec23290f4bb681592ef8fc439c1a831bfe917fb09dd0fedca35dd4f09","agent_input/contexts/1e8a8a58f75e6d1da5ce21b8b1aab54da6bed4dc66d1d2adb571a48eef663a5c/sources/0000.txt":"sha256:da96091dd8169c53cc88142cbf56a55a550a58b8446049cdddba84d971362284","agent_input/contexts/1e8a8a58f75e6d1da5ce21b8b1aab54da6bed4dc66d1d2adb571a48eef663a5c/sources/0001.txt":"sha256:ae5f362e4748c22318b5cf74e13f5a7a4253eb624237b411001d279d80fd7435","agent_input/contexts/1e8a8a58f75e6d1da5ce21b8b1aab54da6bed4dc66d1d2adb571a48eef663a5c/sources/0002.txt":"sha256:e56b2ab42714ed6bdfacb0f5b8db78e1b91d59829b100696b0bd3ca13167ec87","agent_input/contexts/1e8a8a58f75e6d1da5ce21b8b1aab54da6bed4dc66d1d2adb571a48eef663a5c/sources/0003.txt":"sha256:be25562001e67e8c429bba37a3702e75c7d2e8676aa67e0dafc83f5bb0c0bf64","agent_input/contexts/6f828e2140b43396b82361f48172014eec05f35dcb2e6213b315c697a2c7b84b/envelope.json":"sha256:01679d4e0f79198d1ebb0ccce45b24a495e8b4d20fd9ad741e82aa3176f5cee6","agent_input/contexts/6f828e2140b43396b82361f48172014eec05f35dcb2e6213b315c697a2c7b84b/source-index.json":"sha256:5a5550a2d6f729e85cdb9a5adfbecc4c34bd428d5321bfab0d35b10c61cd0138","agent_input/contexts/6f828e2140b43396b82361f48172014eec05f35dcb2e6213b315c697a2c7b84b/sources/0000.txt":"sha256:da96091dd8169c53cc88142cbf56a55a550a58b8446049cdddba84d971362284","agent_input/contexts/6f828e2140b43396b82361f48172014eec05f35dcb2e6213b315c697a2c7b84b/sources/0001.txt":"sha256:ae5f362e4748c22318b5cf74e13f5a7a4253eb624237b411001d279d80fd7435","agent_input/contexts/6f828e2140b43396b82361f48172014eec05f35dcb2e6213b315c697a2c7b84b/sources/0002.txt":"sha256:e56b2ab42714ed6bdfacb0f5b8db78e1b91d59829b100696b0bd3ca13167ec87","agent_input/contexts/6f828e2140b43396b82361f48172014eec05f35dcb2e6213b315c697a2c7b84b/sources/0003.txt":"sha256:be25562001e67e8c429bba37a3702e75c7d2e8676aa67e0dafc83f5bb0c0bf64","agent_input/contexts/820ca6581d8c32a7c38327a60ca03ecba6a7682021a0468e544f44a5fe357361/envelope.json":"sha256:65590173045a8f0e55f0fed2a2b3e2b358ce70d7a6890ae466ca075ce95543cd","agent_input/contexts/820ca6581d8c32a7c38327a60ca03ecba6a7682021a0468e544f44a5fe357361/source-index.json":"sha256:f2f102bf089795364434513f9a074ca3da5b5e09e7d2a79ce4b77fe5f31adf15","agent_input/contexts/820ca6581d8c32a7c38327a60ca03ecba6a7682021a0468e544f44a5fe357361/sources/0000.txt":"sha256:da96091dd8169c53cc88142cbf56a55a550a58b8446049cdddba84d971362284","agent_input/contexts/820ca6581d8c32a7c38327a60ca03ecba6a7682021a0468e544f44a5fe357361/sources/0001.txt":"sha256:ae5f362e4748c22318b5cf74e13f5a7a4253eb624237b411001d279d80fd7435","agent_input/contexts/820ca6581d8c32a7c38327a60ca03ecba6a7682021a0468e544f44a5fe357361/sources/0002.txt":"sha256:e56b2ab42714ed6bdfacb0f5b8db78e1b91d59829b100696b0bd3ca13167ec87","agent_input/contexts/820ca6581d8c32a7c38327a60ca03ecba6a7682021a0468e544f44a5fe357361/sources/0003.txt":"sha256:be25562001e67e8c429bba37a3702e75c7d2e8676aa67e0dafc83f5bb0c0bf64","agent_input/contexts/de081c138fe25e9d44d1778bd7602a518f2cff87a2ddc803a9f961bacd3db9b5/envelope.json":"sha256:da508971c7d19ad6489211c4a2824f69190f2d1aa966898a5b7dac954ac202f9","agent_input/contexts/de081c138fe25e9d44d1778bd7602a518f2cff87a2ddc803a9f961bacd3db9b5/source-index.json":"sha256:4f53cda18c2baa0c0354bb5f9a3ecbe5ed12ab4d8e11ba873c2f11161202b945","agent_input/contexts/e8aae4e60795891047f4b7cfc9f27e04b55acc041e60f90e89e14890abec0ce6/envelope.json":"sha256:4dacf29e3ac08d5257aff790fa4d0ea18619b36273a2ffdf12125fade4f7ddce","agent_input/contexts/e8aae4e60795891047f4b7cfc9f27e04b55acc041e60f90e89e14890abec0ce6/source-index.json":"sha256:9b95b8230d364a65914d579fd4e0d78293907fc049d26b86b5c8e60f93e6a702","agent_input/contexts/e8aae4e60795891047f4b7cfc9f27e04b55acc041e60f90e89e14890abec0ce6/sources/0000.txt":"sha256:da96091dd8169c53cc88142cbf56a55a550a58b8446049cdddba84d971362284","agent_input/contexts/e8aae4e60795891047f4b7cfc9f27e04b55acc041e60f90e89e14890abec0ce6/sources/0001.txt":"sha256:ae5f362e4748c22318b5cf74e13f5a7a4253eb624237b411001d279d80fd7435","agent_input/contexts/e8aae4e60795891047f4b7cfc9f27e04b55acc041e60f90e89e14890abec0ce6/sources/0002.txt":"sha256:e56b2ab42714ed6bdfacb0f5b8db78e1b91d59829b100696b0bd3ca13167ec87","agent_input/contexts/e8aae4e60795891047f4b7cfc9f27e04b55acc041e60f90e89e14890abec0ce6/sources/0003.txt":"sha256:be25562001e67e8c429bba37a3702e75c7d2e8676aa67e0dafc83f5bb0c0bf64","agent_input/instruction.txt":"sha256:3df6b5270048166160b6f23fb148984350f2611cac211e3136ced2993e39267a","agent_input/mechanism-ontology.json":"sha256:7f79f39e74fc9e50151fb9a8c2895c6c19a0ebd5ac64295112e9e1a2073a820a","agent_input/obligations.json":"sha256:05d5fbeb48bf4b160b7c8f8449de099566a8c7e725bbd53083bf4d157d6f2314","agent_input/trial.json":"sha256:8689462ef028225eb37b207148ffd169e064c8fb3d7cdb2464e9465859b42b79","manifest.json":"sha256:e8927f2edd1db7710140d375540536e07dc3efa14a840a43704b6e8ba6e46e81"},"input_manifest_hash":"sha256:944bb3cc4e058d3c15f37ee5172f643ff1ccb8412177bf040999ad568df69f1b","prompt_hash":"sha256:53814775a848af6b911a2b484e9b05fc7449e0a05c118cca42728f5c9d4ef370","prompt_version":"reviewgraphen.process_reviewer_prompt.v1","raw_response":"{\"schema\":\"reviewgraphen.benchmark.candidate_output.v1\",\"trial_id\":\"m7-real:snapshot-11:full_review_graphen:1\",\"outcome\":\"structured\",\"findings\":[{\"local_id\":\"idempotency-presence-only\",\"locations\":[{\"path\":\"rust/fsl-tools/src/domain.rs\",\"start_line\":34,\"end_line\":41}],\"mechanism_tags\":[\"check_write_gap\",\"repeated_effect\",\"unstable_token\"],\"rationale\":\"The irreversible-effect check accepts any present idempotency_key without establishing that the key is stable across retries, uniquely scopes the operation, or is atomically checked and recorded with the side effect. A per-attempt or otherwise unstable expression therefore suppresses the hard finding while duplicate irreversible execution remains possible, especially under concurrent reentry.\",\"severity\":\"high\"}],\"obligation_results\":[{\"packet_id\":\"context-envelope:sha256:0262870fd2752983854b3d6d61a0fbca8a6a302f208e170cf6ae0cfd33c88008\",\"disposition\":\"inconclusive\",\"finding_local_ids\":[]},{\"packet_id\":\"context-envelope:sha256:75ba308fdb4f652c6508edd7d8c09263c974e03de87cabcfa66c70f3d2e2a0e2\",\"disposition\":\"issue_present\",\"finding_local_ids\":[\"idempotency-presence-only\"]},{\"packet_id\":\"context-envelope:sha256:c0ae6f02c79ba782c12b2e37a531fd645355e1e973eae06d60aa6950744003c9\",\"disposition\":\"issue_present\",\"finding_local_ids\":[\"idempotency-presence-only\"]},{\"packet_id\":\"context-envelope:sha256:d283494ca3bb32d2d280558014e8682cd030cb90e5b095da29594d7f11733792\",\"disposition\":\"issue_present\",\"finding_local_ids\":[\"idempotency-presence-only\"]},{\"packet_id\":\"context-envelope:sha256:e4cf21539a2fb3e78ac1960e63babbf1df74955aedba2858302f84a2ba40a2b9\",\"disposition\":\"inconclusive\",\"finding_local_ids\":[]}]}","raw_response_hash":"sha256:f079a45e95432945a82aef78847f66b39a3ed63bb3b5048421ef3cf01c5213fe","schema":"reviewgraphen.process_reviewer_record.v1","stderr_hash":"sha256:610e9d0da4c67bd40b711866feab24cf12c2b067fcbdf4e87d234213bb364046","stdout_hash":"sha256:e1c26e61a7a8226faa0b24395a21ec176fe8e08af4f3b5e232a60f39d292572e","tool_policy_version":"reviewgraphen.process_reviewer.bwrap-no-tools.v1"}