{"backend":{"inference_settings":{"reasoning_effort":"high"},"kind":"codex_cli","model":"gpt-5.6-sol","protocol_version":"codex-exec@0.147.0","provider":"openai"},"exit_code":0,"input_files":{"agent_input/candidate-output.schema.json":"sha256:84756b26da6271c1e79ba68408b24869fc421ed80aaffff4f90160131fe635df","agent_input/contexts/08927452afe988b5eeff71a101f4091205961c1b67208fff549a67104497d87b/envelope.json":"sha256:c5e5b8deb4a22d3f90f18dbb002fd7aed72dc65935763d220880a61cf662407a","agent_input/contexts/08927452afe988b5eeff71a101f4091205961c1b67208fff549a67104497d87b/source-index.json":"sha256:4f53cda18c2baa0c0354bb5f9a3ecbe5ed12ab4d8e11ba873c2f11161202b945","agent_input/contexts/2a92881aada74567e4a1f9ebe3befd9dbef1d9b58df53520694842708e944fe1/envelope.json":"sha256:a5bc05f1fe3be31585b8738d8681c9c98ad33cf1242d716d467891ced429e1d8","agent_input/contexts/2a92881aada74567e4a1f9ebe3befd9dbef1d9b58df53520694842708e944fe1/source-index.json":"sha256:215d015038ed736f3567590cff3e85d684b40d7c74448976db69fbc03de63c9c","agent_input/contexts/2a92881aada74567e4a1f9ebe3befd9dbef1d9b58df53520694842708e944fe1/sources/0000.txt":"sha256:66d6ce89086937be1db4aeb8fd0072b9959149787541e4b22645dfa2537a6b29","agent_input/contexts/ab40e5146c4c9d623a4d202864ed6afe8f29c2dc2fdcbe8c14ba4c77223d38ea/envelope.json":"sha256:cf6ff25ae2fed4e72a070042c3c0a4c95a05a6070ead6146b3ea922c2ef967b2","agent_input/contexts/ab40e5146c4c9d623a4d202864ed6afe8f29c2dc2fdcbe8c14ba4c77223d38ea/source-index.json":"sha256:92e547acf3251df44619c3e3b7e19ae5753964ccc77e75359e77947ce82fcb59","agent_input/contexts/ab40e5146c4c9d623a4d202864ed6afe8f29c2dc2fdcbe8c14ba4c77223d38ea/sources/0000.txt":"sha256:66d6ce89086937be1db4aeb8fd0072b9959149787541e4b22645dfa2537a6b29","agent_input/contexts/cca95dfbfd72e6f51a772c9c1a9d03dd52fc41e231c4b46cd5d62529f6ab1f2d/envelope.json":"sha256:82d3688ca94bf32d2dd80382a50a3a5769d35d5b34f72bf19f9e013968128c17","agent_input/contexts/cca95dfbfd72e6f51a772c9c1a9d03dd52fc41e231c4b46cd5d62529f6ab1f2d/source-index.json":"sha256:3b9608e22c95256f9349f206b3aa9f3363824a3069419c9ac9a5244193261ca6","agent_input/contexts/cca95dfbfd72e6f51a772c9c1a9d03dd52fc41e231c4b46cd5d62529f6ab1f2d/sources/0000.txt":"sha256:66d6ce89086937be1db4aeb8fd0072b9959149787541e4b22645dfa2537a6b29","agent_input/contexts/ea51de59fc473f293d0828cb94c1d738da4cc9db0e258eeea5f1afafdcce91f8/envelope.json":"sha256:9d30a128e222b7ef4e33499bc28a0b84c3a3b6e0cd9ee1e7e8e0026c0d88aa0e","agent_input/contexts/ea51de59fc473f293d0828cb94c1d738da4cc9db0e258eeea5f1afafdcce91f8/source-index.json":"sha256:c23a43907a6f0cf00800fcde51dfdecc622bacd5145f1fcf8d5a004e6eb0d33f","agent_input/contexts/ea51de59fc473f293d0828cb94c1d738da4cc9db0e258eeea5f1afafdcce91f8/sources/0000.txt":"sha256:66d6ce89086937be1db4aeb8fd0072b9959149787541e4b22645dfa2537a6b29","agent_input/instruction.txt":"sha256:3df6b5270048166160b6f23fb148984350f2611cac211e3136ced2993e39267a","agent_input/mechanism-ontology.json":"sha256:7f79f39e74fc9e50151fb9a8c2895c6c19a0ebd5ac64295112e9e1a2073a820a","agent_input/obligations.json":"sha256:a6c54c3b5ebd67993e76c02738050befba4a97728906a99ba2c1d36186e5f646","agent_input/trial.json":"sha256:9486b64dc0a1777d0d83041d016332e1f282e12978d1f43268ccf38e2d9c9f7b","manifest.json":"sha256:7246f1bde18d1fd243b43c8af803c46e56903baffce91a75e09079d8fe78637b"},"input_manifest_hash":"sha256:036528714a832dff3dd6fa9c373833a618affbfe68fc9d314c3663bbec753937","prompt_hash":"sha256:53814775a848af6b911a2b484e9b05fc7449e0a05c118cca42728f5c9d4ef370","prompt_version":"reviewgraphen.process_reviewer_prompt.v1","raw_response":"{\"schema\":\"reviewgraphen.benchmark.candidate_output.v1\",\"trial_id\":\"m7-real:snapshot-13:full_review_graphen:2\",\"outcome\":\"structured\",\"findings\":[],\"obligation_results\":[{\"packet_id\":\"context-envelope:sha256:1d15857519a7a4b31cb2b4d16a7af713e86922e00f1f749825e435a95d3f6aa3\",\"disposition\":\"inconclusive\",\"finding_local_ids\":[]},{\"packet_id\":\"context-envelope:sha256:5e8cd42b50fd030ced8918d54bf93884a5f00227f66fe1b815a85b2d83fbc900\",\"disposition\":\"inconclusive\",\"finding_local_ids\":[]},{\"packet_id\":\"context-envelope:sha256:8d0dc755c9b724c64ced4bc52fd56eb1769e9b4204ab2c64bd718075d5e2ae08\",\"disposition\":\"inconclusive\",\"finding_local_ids\":[]},{\"packet_id\":\"context-envelope:sha256:995598f4dae6fbe856e70e2d65c540709ec2130f6ee4800a1f22a4f2a4a12ad9\",\"disposition\":\"inconclusive\",\"finding_local_ids\":[]},{\"packet_id\":\"context-envelope:sha256:fbd3de293add89a8cd04db32786e990b9d3e6e93740427af162f3690647c91af\",\"disposition\":\"inconclusive\",\"finding_local_ids\":[]}]}","raw_response_hash":"sha256:f3576db6a2e19fdec2167dfaab048b1cb41ab5c2a671aec28259bf2f97487eaf","schema":"reviewgraphen.process_reviewer_record.v1","stderr_hash":"sha256:3e75d28a6681c31400a3f0fcb564c7613fd42796fb83294e4d53fea86bcbd401","stdout_hash":"sha256:8afcd04a132f10cf5b7b35c7a9420f76e2243522bc5f50eddb22e958c402ba63","tool_policy_version":"reviewgraphen.process_reviewer.bwrap-no-tools.v1"}