{"backend":{"inference_settings":{"reasoning_effort":"high"},"kind":"codex_cli","model":"gpt-5.6-sol","protocol_version":"codex-exec@0.147.0","provider":"openai"},"exit_code":0,"input_files":{"agent_input/candidate-output.schema.json":"sha256:84756b26da6271c1e79ba68408b24869fc421ed80aaffff4f90160131fe635df","agent_input/contexts/17fcdb685b54b704a3ce3de28aad2017ba93bd00dbd73a54ae16b491864437bd/envelope.json":"sha256:101e1bdab9c63892b137a03f96f69c65059005a0612a20f518fc7682d627c65e","agent_input/contexts/17fcdb685b54b704a3ce3de28aad2017ba93bd00dbd73a54ae16b491864437bd/source-index.json":"sha256:4f8bc4803279066b54e9be9e31590b15ff0e0c0ab1387aef16acb05db79a4d93","agent_input/contexts/17fcdb685b54b704a3ce3de28aad2017ba93bd00dbd73a54ae16b491864437bd/sources/0000.txt":"sha256:1bff0773716370b9c9a48b9394243b15b61dcc2e582fb8b529d85e866e22d961","agent_input/contexts/17fcdb685b54b704a3ce3de28aad2017ba93bd00dbd73a54ae16b491864437bd/sources/0001.txt":"sha256:6de75a4fdc34d91e409312bfc05b3848c7b66dd46478a366a1ff642ae9ab5b64","agent_input/contexts/7596ccef77fa1fe825991523b4db18965b37e992eac8527ae4a5abc8afde7c63/envelope.json":"sha256:36bb297657625617df4a070e6a4e6e92e424380557135e6a89853cfc9920e701","agent_input/contexts/7596ccef77fa1fe825991523b4db18965b37e992eac8527ae4a5abc8afde7c63/source-index.json":"sha256:443037e04853840dc8e1e142ddc416a18f5bfc1a7ba49102151ce53d893dd034","agent_input/contexts/7596ccef77fa1fe825991523b4db18965b37e992eac8527ae4a5abc8afde7c63/sources/0000.txt":"sha256:1bff0773716370b9c9a48b9394243b15b61dcc2e582fb8b529d85e866e22d961","agent_input/contexts/7596ccef77fa1fe825991523b4db18965b37e992eac8527ae4a5abc8afde7c63/sources/0001.txt":"sha256:6de75a4fdc34d91e409312bfc05b3848c7b66dd46478a366a1ff642ae9ab5b64","agent_input/contexts/841ef68e2bc776d64096814ce32e0e5522861cdfab085575e741464783f2e3d0/envelope.json":"sha256:4991bea146605f2c52c952f8d7fdbc0cd110f4695bacbd3b859c6ff6714d7c45","agent_input/contexts/841ef68e2bc776d64096814ce32e0e5522861cdfab085575e741464783f2e3d0/source-index.json":"sha256:33274bfe9cebb91b1eadba9a5d3be4fd0f347c78c7bc2183ccb0848e61855650","agent_input/contexts/841ef68e2bc776d64096814ce32e0e5522861cdfab085575e741464783f2e3d0/sources/0000.txt":"sha256:1bff0773716370b9c9a48b9394243b15b61dcc2e582fb8b529d85e866e22d961","agent_input/contexts/841ef68e2bc776d64096814ce32e0e5522861cdfab085575e741464783f2e3d0/sources/0001.txt":"sha256:6de75a4fdc34d91e409312bfc05b3848c7b66dd46478a366a1ff642ae9ab5b64","agent_input/contexts/9ea5073016f294a38e8eb098c2fea68a64084ae1556f01d61d724fc44ff91965/envelope.json":"sha256:86c3a10832f2463c4fd26a3c26298f9befb7063ffc6d62c653ef41a5ec8242d1","agent_input/contexts/9ea5073016f294a38e8eb098c2fea68a64084ae1556f01d61d724fc44ff91965/source-index.json":"sha256:4f53cda18c2baa0c0354bb5f9a3ecbe5ed12ab4d8e11ba873c2f11161202b945","agent_input/contexts/bf01bde0e2a3a1ab622bb28a726cc2ec09c9b6425e75550cfed43bfdd1615c0e/envelope.json":"sha256:15cc3ae1d4a2e4201fd6861bef0245e0290bebfb2eb28249ce6f550b4f7c68e6","agent_input/contexts/bf01bde0e2a3a1ab622bb28a726cc2ec09c9b6425e75550cfed43bfdd1615c0e/source-index.json":"sha256:df77d24c6d5411de52be7a2d211a3760c0513de24e95dd312625ac75253e373a","agent_input/contexts/bf01bde0e2a3a1ab622bb28a726cc2ec09c9b6425e75550cfed43bfdd1615c0e/sources/0000.txt":"sha256:1bff0773716370b9c9a48b9394243b15b61dcc2e582fb8b529d85e866e22d961","agent_input/contexts/bf01bde0e2a3a1ab622bb28a726cc2ec09c9b6425e75550cfed43bfdd1615c0e/sources/0001.txt":"sha256:6de75a4fdc34d91e409312bfc05b3848c7b66dd46478a366a1ff642ae9ab5b64","agent_input/instruction.txt":"sha256:3df6b5270048166160b6f23fb148984350f2611cac211e3136ced2993e39267a","agent_input/mechanism-ontology.json":"sha256:7f79f39e74fc9e50151fb9a8c2895c6c19a0ebd5ac64295112e9e1a2073a820a","agent_input/obligations.json":"sha256:a267e7accdfb7df791b21a499ff882fe30e3633cbea6c10b6d4977d4cd72307c","agent_input/trial.json":"sha256:371d6859d8ce2fce47f60e3521db01299be4b3dc5815b70e5074184a1077fc23","manifest.json":"sha256:03f52085e71da6d69062971b7ca982054936fead170939c88ef493ac723effdd"},"input_manifest_hash":"sha256:21b66a20ba2629b3014bdbd7741db8c4cf3b7d15d15847e05f89e275bfaabb1f","prompt_hash":"sha256:53814775a848af6b911a2b484e9b05fc7449e0a05c118cca42728f5c9d4ef370","prompt_version":"reviewgraphen.process_reviewer_prompt.v1","raw_response":"{\"schema\":\"reviewgraphen.benchmark.candidate_output.v1\",\"trial_id\":\"m7-real:snapshot-04:full_review_graphen:1\",\"outcome\":\"structured\",\"findings\":[{\"local_id\":\"builtin-id-type-backfill-divergence\",\"locations\":[{\"path\":\"rust/fsl-core/src/domain.rs\",\"start_line\":178,\"end_line\":211},{\"path\":\"rust/fsl-core/src/domain_lowering.rs\",\"start_line\":312,\"end_line\":349}],\"mechanism_tags\":[\"cross_file_contract\"],\"rationale\":\"The rendering Context backfills every undeclared aggregate id_type as an external type, including built-ins Int and Bool, whereas Resolver explicitly excludes those built-ins. A domain using a built-in ID can therefore acquire a synthetic 0..1 external declaration in the text-rendering path while structured lowering retains the built-in type, producing divergent semantics or a conflicting declaration.\",\"severity\":\"medium\"}],\"obligation_results\":[{\"packet_id\":\"context-envelope:sha256:002fc094c6e005f602715fa93b0f61c4fae36bae6c583dadc5b585d5f5af80f1\",\"disposition\":\"inconclusive\",\"finding_local_ids\":[]},{\"packet_id\":\"context-envelope:sha256:7fdd9390fb98dcfd18ebcc3b9665767d090038737dfc259425d88318cf82c9ed\",\"disposition\":\"inconclusive\",\"finding_local_ids\":[]},{\"packet_id\":\"context-envelope:sha256:8471e88dfae71ba7612d85d8465cedcdee8239f3b90724284d296913c098dd24\",\"disposition\":\"inconclusive\",\"finding_local_ids\":[]},{\"packet_id\":\"context-envelope:sha256:a74a2cc70640674782a95e5f1c06bdfad40599596b3cbab0acea8ebb2d6b2a04\",\"disposition\":\"inconclusive\",\"finding_local_ids\":[]},{\"packet_id\":\"context-envelope:sha256:eb64bb1290274de48f736736c38c0f7ffcf46ff2bfff303f5834de8ae400c8b8\",\"disposition\":\"issue_present\",\"finding_local_ids\":[\"builtin-id-type-backfill-divergence\"]}]}","raw_response_hash":"sha256:6e85ff6a8c879548a754847057273e237f5fe2e2e25ef8d27aeb21bfa9339147","schema":"reviewgraphen.process_reviewer_record.v1","stderr_hash":"sha256:3e75d28a6681c31400a3f0fcb564c7613fd42796fb83294e4d53fea86bcbd401","stdout_hash":"sha256:99027cb9ff77cef38b11ff9eab7b036556a22a9625d5e2f3204337b9b9e8477d","tool_policy_version":"reviewgraphen.process_reviewer.bwrap-no-tools.v1"}