{"backend":{"inference_settings":{"reasoning_effort":"high"},"kind":"codex_cli","model":"gpt-5.6-sol","protocol_version":"codex-exec@0.147.0","provider":"openai"},"exit_code":0,"input_files":{"agent_input/candidate-output.schema.json":"sha256:84756b26da6271c1e79ba68408b24869fc421ed80aaffff4f90160131fe635df","agent_input/contexts/2594d1c8c6ae8e841f39c918eb358d6e67ed63b504f0a9fddf2c8be27dff3c8a/envelope.json":"sha256:5036592f4606b759338106bf3905bbef734797e378f950770fcf3532b9a431a2","agent_input/contexts/2594d1c8c6ae8e841f39c918eb358d6e67ed63b504f0a9fddf2c8be27dff3c8a/source-index.json":"sha256:3e6b33a950a39591bb36e88bc235890b868634d6a841641b9a4300d43225529c","agent_input/contexts/2594d1c8c6ae8e841f39c918eb358d6e67ed63b504f0a9fddf2c8be27dff3c8a/sources/0000.txt":"sha256:72c2ac496bedaaa5baa456cae6203e5c130dd426776756134ef0aee12a994c86","agent_input/contexts/45a55aa13d693d8b7bb3ee326fda97b04137f8af18596ef4ffd52bfa78171620/envelope.json":"sha256:de0f0a8ba641efcaf51a949475b1a3b69f92c0e0e2f117015fb02c0afe634c39","agent_input/contexts/45a55aa13d693d8b7bb3ee326fda97b04137f8af18596ef4ffd52bfa78171620/source-index.json":"sha256:9db720b99ccb5e2a6123e93c3a132b6da02b5e2e6b453a0810cf84e67fd70935","agent_input/contexts/45a55aa13d693d8b7bb3ee326fda97b04137f8af18596ef4ffd52bfa78171620/sources/0000.txt":"sha256:72c2ac496bedaaa5baa456cae6203e5c130dd426776756134ef0aee12a994c86","agent_input/contexts/4616fce6fa390316c32586b6483ad17fbc0b712d0eb2e2ec8a3fa0bf06d5d2ca/envelope.json":"sha256:600b58f6e8d5f8d740d6cd09ac072c746c52e236da85f3f25b0b9c0b4aeebc32","agent_input/contexts/4616fce6fa390316c32586b6483ad17fbc0b712d0eb2e2ec8a3fa0bf06d5d2ca/source-index.json":"sha256:e34f77540cf125355795bc1d35d3c178e220f6ebe67f5752fd122e8e2f49b1fd","agent_input/contexts/4616fce6fa390316c32586b6483ad17fbc0b712d0eb2e2ec8a3fa0bf06d5d2ca/sources/0000.txt":"sha256:72c2ac496bedaaa5baa456cae6203e5c130dd426776756134ef0aee12a994c86","agent_input/contexts/60d0ef3e9f31ea3ebfa369885d112e47e7b9873c6e5f33df85ceab93a229c35b/envelope.json":"sha256:4b52f7a295bb3762bb547e3ba60e714fd0abde6341ae9076e468ddc930f6af55","agent_input/contexts/60d0ef3e9f31ea3ebfa369885d112e47e7b9873c6e5f33df85ceab93a229c35b/source-index.json":"sha256:4f53cda18c2baa0c0354bb5f9a3ecbe5ed12ab4d8e11ba873c2f11161202b945","agent_input/contexts/97d32dc0f6b7d784d53d8541af7f48c10ba27fbd58c515eb22834f5da7f2b4f3/envelope.json":"sha256:31647ad6e909949b27895ca772fbedbec8b1b46e551e47b39b9f945b41b15d1a","agent_input/contexts/97d32dc0f6b7d784d53d8541af7f48c10ba27fbd58c515eb22834f5da7f2b4f3/source-index.json":"sha256:f33f30af2f987e1899385ee7b4873e04ec594df429b5f667e35c9cdfa28cb1b7","agent_input/contexts/97d32dc0f6b7d784d53d8541af7f48c10ba27fbd58c515eb22834f5da7f2b4f3/sources/0000.txt":"sha256:72c2ac496bedaaa5baa456cae6203e5c130dd426776756134ef0aee12a994c86","agent_input/instruction.txt":"sha256:3df6b5270048166160b6f23fb148984350f2611cac211e3136ced2993e39267a","agent_input/mechanism-ontology.json":"sha256:7f79f39e74fc9e50151fb9a8c2895c6c19a0ebd5ac64295112e9e1a2073a820a","agent_input/obligations.json":"sha256:1c177fd4bc8347cb694863cacdf43afbdad40c3c869d57781749db808d67b30d","agent_input/trial.json":"sha256:b950d0a49418dd712b517c0557c0c5eec6a69d854463a940f17ddae683c4cf9b","manifest.json":"sha256:2ecf2139f54967b35371badf53ff8e907ab6d9c8c43760e6df470ba3ec3e9128"},"input_manifest_hash":"sha256:3917c4c30a258dfb4154f34f4ac99b82c24e62a2305ce1fb7dd88469210b6e68","prompt_hash":"sha256:53814775a848af6b911a2b484e9b05fc7449e0a05c118cca42728f5c9d4ef370","prompt_version":"reviewgraphen.process_reviewer_prompt.v1","raw_response":"{\"schema\":\"reviewgraphen.benchmark.candidate_output.v1\",\"trial_id\":\"m7-real:snapshot-05:full_review_graphen:2\",\"outcome\":\"structured\",\"findings\":[],\"obligation_results\":[{\"packet_id\":\"context-envelope:sha256:3d540f1aed9ff672ec2dec030fadfccd8323278f6998b23357863d45f6b39329\",\"disposition\":\"inconclusive\",\"finding_local_ids\":[]},{\"packet_id\":\"context-envelope:sha256:8993a05ce5d4b667e6e716ed04c067bfb9632a7fd7cb8beaaf7493cbca914a1f\",\"disposition\":\"inconclusive\",\"finding_local_ids\":[]},{\"packet_id\":\"context-envelope:sha256:9878df8c58896e5c64f1bb942fabfa1b51df51cac3b360ac4e6715521c73a0f1\",\"disposition\":\"inconclusive\",\"finding_local_ids\":[]},{\"packet_id\":\"context-envelope:sha256:cbf7413dd9aa584ffa29bf3cefd8d097383903a153a9008ca5fa25e76b667502\",\"disposition\":\"inconclusive\",\"finding_local_ids\":[]},{\"packet_id\":\"context-envelope:sha256:f9db7cd2ab549adcbd17c13809bea7f00de09c3d2733cdf42a33e1aa1cc2ae08\",\"disposition\":\"inconclusive\",\"finding_local_ids\":[]}]}","raw_response_hash":"sha256:cdc26a082bd19725b4e6e4b8288bbe40cb54eb4938a2617d19a197f164543a05","schema":"reviewgraphen.process_reviewer_record.v1","stderr_hash":"sha256:3e75d28a6681c31400a3f0fcb564c7613fd42796fb83294e4d53fea86bcbd401","stdout_hash":"sha256:34285580ba376e6aad00c373344ca7f147217ae490a98c48fd3af9a35b16be9e","tool_policy_version":"reviewgraphen.process_reviewer.bwrap-no-tools.v1"}